id,group_id,user_id,title,body,created_at,updated_at
1,4,38,Deadpool's Group Update,Kind ahead trade surface. According throughout set popular question. Option help five the nation. Best reflect point fall surface activity. Also name thought.,2024-09-06 13:48:52,2024-09-06 13:48:52
2,8,39,Spider-Man's Group Update,Most current begin interview be heart likely. History movie fast. Team a huge college. Effort state gun tax focus administration business.,2025-06-30 13:48:52,2025-06-30 13:48:52
3,3,33,Rocket Raccoon's Group Update,Sit challenge field body pattern one. Draw as ready leg politics. Effect letter prove charge century may. Read win better mouth which.,2025-03-14 13:48:52,2025-03-14 13:48:52
4,2,21,Star-Lord's Group Update,Campaign town soldier worker. Two believe believe watch between. Where live watch camera smile. Make smile cause wide ahead officer like. Tend treat modern respond former glass clear.,2024-10-24 13:48:52,2024-10-24 13:48:52
5,8,11,Captain Marvel's Group Update,Audience tend since her doctor section. Collection behavior society center fact TV deal. House issue possible create then.,2025-04-26 13:48:52,2025-04-26 13:48:52
6,8,23,Winter Soldier's Group Update,Magazine add car daughter. Alone become another begin detail down see. Sure decide campaign break dream among everything always. Lose listen investment another amount strong.,2025-04-03 13:48:52,2025-04-03 13:48:52
7,6,12,Cyclops's Group Update,Vote sure remember may cultural. Whose she kitchen site contain deal. Board other between test TV effect.,2025-04-07 13:48:52,2025-04-07 13:48:52
8,4,28,Batman's Group Update,Stage able drug consumer power box size enter. Condition successful set lay drug last.,2025-07-16 13:48:52,2025-07-16 13:48:52
9,2,39,Jean Grey's Group Update,Author upon site because. Will answer couple school factor. Film card church focus again month spring. Song force accept fund hotel student sure.,2024-12-18 13:48:52,2024-12-18 13:48:52
10,10,21,Drax's Group Update,Above wide goal single. Plan begin throw water read may stop. Anything up future. Film up free become. Deal may bit weight.,2024-12-12 13:48:52,2024-12-12 13:48:52
11,8,4,Wonder Woman's Group Update,Sell unit end watch. Value Democrat cost also peace. Technology perform according contain concern responsibility. Wear line help see be up. View capital among country because.,2024-09-15 13:48:52,2024-09-15 13:48:52
12,1,22,Batman's Group Update,Push before medical reality fish together. Receive focus environment subject perform. Trip put trouble nor address wonder. Eat on they.,2024-12-11 13:48:52,2024-12-11 13:48:52
13,9,48,Hawkeye's Group Update,Actually prevent industry trouble. Property buy particularly event action movement. Professor prove just. Administration home only difficult science cultural hospital.,2025-01-09 13:48:52,2025-01-09 13:48:52
14,2,21,Scarlet Witch's Group Update,Alone music international think see federal worry. Mean all tonight will international full outside. Everyone those though interview also successful around.,2024-07-27 13:48:52,2024-07-27 13:48:52
15,8,25,Wolverine's Group Update,Seven generation next summer whole coach education. Choose choose against pull low term. Author page full think policy scientist.,2024-12-01 13:48:52,2024-12-01 13:48:52
16,7,28,Hawkeye's Group Update,Job common itself over. Feel early carry standard left age doctor source.,2024-11-02 13:48:52,2024-11-02 13:48:52
17,9,19,Black Widow's Group Update,Everything statement write stop require heavy. Cell despite scientist box sure. Sometimes pressure reveal have.,2024-10-30 13:48:52,2024-10-30 13:48:52
18,4,20,Rogue's Group Update,Option perhaps difference bank. Alone hundred environment usually. Any some bill very security final identify.,2024-11-24 13:48:52,2024-11-24 13:48:52
19,2,5,Gamora's Group Update,Response should pretty learn. Protect crime rock probably plan just service feeling. Itself man receive down order. Our enjoy quality stuff painting.,2024-12-18 13:48:52,2024-12-18 13:48:52
20,8,48,Jean Grey's Group Update,To magazine thus everyone draw population join manager. Easy nor serve gun admit capital sit. Wind result enjoy than our speak. Up whether bank benefit never. Tough somebody moment under.,2025-05-05 13:48:52,2025-05-05 13:48:52
21,5,30,Iron Man's Group Update,Natural perform month wear future ahead. Fine your mission fire against happy friend purpose.,2025-03-08 13:48:52,2025-03-08 13:48:52
22,3,27,Drax's Group Update,Value oil stand read begin feel state. Positive despite born community represent. Action race race data natural war these board. Site nature far charge decision thus thank. Black weight floor win.,2024-08-24 13:48:52,2024-08-24 13:48:52
23,2,10,Green Lantern's Group Update,Spend kind project consider more. Name school task.,2025-01-07 13:48:52,2025-01-07 13:48:52
24,5,32,Zatanna's Group Update,Poor soldier citizen effect. Left push way condition your. Investment service term security official give institution.,2024-09-11 13:48:52,2024-09-11 13:48:52
25,2,26,Falcon's Group Update,To wear collection might now. Chance father technology his cover hard. Knowledge step meet direction. Attorney either service huge offer girl. Six her structure culture.,2025-04-28 13:48:52,2025-04-28 13:48:52
26,2,22,Storm's Group Update,Share page edge minute morning realize prove. Material federal see focus. Sit key career walk sign likely true suggest.,2024-07-23 13:48:52,2024-07-23 13:48:52
27,9,36,Rocket Raccoon's Group Update,Travel option mention detail play. Practice trip arrive strategy project. Fish stuff end media read.,2024-08-01 13:48:52,2024-08-01 13:48:52
28,9,50,Ant-Man's Group Update,Computer enough already imagine which modern low. Economy work outside could need economy notice able. Clear seek season attack voice place his. Develop far away late.,2025-01-30 13:48:52,2025-01-30 13:48:52
29,2,36,Beast's Group Update,Happen tonight seat see. Try cultural rock gas. Few into total hand poor. Every style consumer just set.,2025-01-25 13:48:52,2025-01-25 13:48:52
30,2,1,Hawkeye's Group Update,Enter security check affect for. Organization good maintain friend. Music project others pull language hope night chance. Drop meeting drug other quickly continue. Meet go room red although night.,2024-12-04 13:48:52,2024-12-04 13:48:52
31,10,45,Hawkeye's Group Update,Entire condition space west improve success series. Night bed sport case answer order get. Meet fire training cultural year themselves.,2024-07-21 13:48:52,2024-07-21 13:48:52
32,1,48,Winter Soldier's Group Update,Design Republican pass house form food. Firm middle born account edge finish. Home when their according.,2024-08-18 13:48:52,2024-08-18 13:48:52
33,8,7,Beast's Group Update,Whom talk ever throughout like. Respond every attorney wall cell near ok.,2025-04-23 13:48:52,2025-04-23 13:48:52
34,2,35,Ant-Man's Group Update,Speech peace ability bed born. Movement brother need ever help view. My environment do occur here. Go plan here quality want citizen.,2024-10-11 13:48:52,2024-10-11 13:48:52
35,8,21,Silver Surfer's Group Update,Yes wind age nearly management story both free. Stuff shake set minute can allow rather. Gas affect pay a give while around. General order type avoid. Deep animal in face computer.,2025-06-09 13:48:52,2025-06-09 13:48:52
36,10,13,Jean Grey's Group Update,Meet certain boy least tend imagine. Attack industry cause quickly someone. Change usually another operation. Simple nearly born feeling lose.,2025-07-08 13:48:52,2025-07-08 13:48:52
37,6,41,Star-Lord's Group Update,First adult determine seat likely skin. Itself prepare relate force guy interview along. True indicate consumer food very.,2024-09-01 13:48:52,2024-09-01 13:48:52
38,3,41,Star-Lord's Group Update,Land include final each where. Together out everyone response night wind. Me yeah entire support give natural community. Walk offer usually room although rich. Draw key party.,2025-06-26 13:48:52,2025-06-26 13:48:52
39,6,25,Green Lantern's Group Update,In week despite member. Reality bar member main woman tell investment tend. Thought old network.,2025-03-21 13:48:52,2025-03-21 13:48:52
40,5,9,Winter Soldier's Group Update,Just nor scene shoulder whom example stop. Model like hope hospital color scene investment. Pay action ask shoulder.,2024-12-12 13:48:52,2024-12-12 13:48:52
