id,user_id,title,body,visibility,created_at,updated_at
1,39,Cyclops's Mission Report,If professor face white yeah to. Significant check eye however. Old board beautiful top many law. Piece door check college forget time risk. Through establish scientist suggest far focus. Child class enter another interest place in investment.,private,2025-05-29 13:48:52,2025-05-29 13:48:52
2,28,Groot's Mission Report,Low bag young charge. Billion pressure pick his since story. Weight avoid able team would another final. Hold suddenly recognize end cell control. Him act clearly relate offer program first.,public,2025-03-30 13:48:52,2025-03-30 13:48:52
3,33,Shazam's Mission Report,Head before machine quite dark forward imagine air. We environment hope maintain. Approach mission between put white. Body child news fight thing among order. Policy leader painting professional truth old experience. Plant development everything bag note newspaper site.,private,2025-01-29 13:48:52,2025-01-29 13:48:52
4,19,Vision's Mission Report,Rest fund film focus hair. Answer when anyone allow. Book event already significant popular daughter seven. Team quality final property parent create half new.,public,2025-05-21 13:48:52,2025-05-21 13:48:52
5,1,Winter Soldier's Mission Report,Television nice a open. Memory service myself name decade it. Early project carry huge hear live there. Defense perform suffer but finish total hold. Someone that simple. Without deal safe.,public,2025-05-14 13:48:52,2025-05-14 13:48:52
6,12,Rogue's Mission Report,Few consider into face face all also. Available commercial avoid plan. Short song week individual population let.,private,2025-03-09 13:48:52,2025-03-09 13:48:52
7,14,Beast's Mission Report,Maintain deal group yes think. Who upon risk speak. Thousand this teach box pattern shoulder. Window ask fight then often event.,public,2025-04-28 13:48:52,2025-04-28 13:48:52
8,8,Falcon's Mission Report,Stay include allow would response here who. Spend machine again everything interview police. Professional response several. Task real threat half second.,private,2024-11-20 13:48:52,2024-11-20 13:48:52
9,25,Jean Grey's Mission Report,Let sound western drive. Long wait government draw have glass history. Sort action fact central sense film. Teach blood project drug economic. Hundred bag let view person. Lot crime scene environment fly year street expect.,public,2025-07-03 13:48:52,2025-07-03 13:48:52
10,3,Aquaman's Mission Report,Fire get present similar age others each. Involve middle feel finish office five audience. Federal one score sense successful.,public,2024-10-31 13:48:52,2024-10-31 13:48:52
11,44,Beast's Mission Report,Industry college like late director people six. Its likely dog level. Kitchen less teacher under mission speak bad.,private,2025-07-13 13:48:52,2025-07-13 13:48:52
12,21,Thor's Mission Report,Without cultural leader interest cultural common half international. Place new take test. Travel author seven matter. Whole sure phone as us employee. Record save animal. Father gun line fact modern per take area.,private,2024-08-15 13:48:52,2024-08-15 13:48:52
13,38,Groot's Mission Report,Daughter partner cup. Room part list follow across little woman. Kid almost four business us laugh himself. Who late talk. Memory own say adult. Painting spring east professional great eat care study.,private,2024-10-15 13:48:52,2024-10-15 13:48:52
14,39,Silver Surfer's Mission Report,Down each near each. Fight north follow past open when. Store way though look. Management hold plant safe treat wear.,private,2024-12-08 13:48:52,2024-12-08 13:48:52
15,20,Winter Soldier's Mission Report,Reduce teacher expect tough agency responsibility apply already. Brother serve order vote your culture. Rock year executive federal bad drop. Popular arrive it music outside. Learn goal exist use always energy human crime. Over fall but marriage.,private,2024-10-02 13:48:52,2024-10-02 13:48:52
16,49,Hulk's Mission Report,Property tax late wall yard stuff minute address. Kid public low quickly another. Lawyer cut lead picture matter will year director. Ground series certain. Sing thousand training we manager expert.,public,2025-01-11 13:48:52,2025-01-11 13:48:52
17,32,Batman's Mission Report,Write less even realize Mr agreement kid. Bad away sit include her rather. Authority home animal treat yes scene carry ready. Assume visit poor remain month.,public,2025-01-17 13:48:52,2025-01-17 13:48:52
18,44,Black Panther's Mission Report,Dark include candidate ago. Agree give and else military whatever. Top term two part store. Significant agency maybe boy floor hear quality. Live pay begin get.,public,2024-07-29 13:48:52,2024-07-29 13:48:52
19,23,Aquaman's Mission Report,Win station keep when. Above woman let everyone soon resource. Center market medical degree administration. Throughout section themselves north field. Consider suggest matter outside. Tend conference citizen detail.,private,2025-04-25 13:48:52,2025-04-25 13:48:52
20,15,Doctor Strange's Mission Report,Involve determine realize whether. National discover fall save use majority. Race knowledge drop market base.,public,2024-10-11 13:48:52,2024-10-11 13:48:52
21,13,Shazam's Mission Report,Success suddenly environmental later pass. Street response wait politics court society cover. Parent doctor character.,public,2025-01-15 13:48:52,2025-01-15 13:48:52
22,25,Groot's Mission Report,Mother say month process minute first. Marriage finally take miss foot region still. Bag project group like economy. Seat everyone coach president suffer tonight by. Be nearly carry worry allow join although.,private,2025-06-21 13:48:52,2025-06-21 13:48:52
23,13,Batman's Mission Report,Pay leave option. Television gun I south after fight. Wrong the cut than protect Democrat. Peace floor laugh age employee since. Thousand in discuss great necessary boy.,private,2025-01-04 13:48:52,2025-01-04 13:48:52
24,18,Doctor Strange's Mission Report,People story recently month should popular feeling. Short realize such she skin alone. List enough live. West fight improve sign fire play. Program this total cold.,private,2025-05-14 13:48:52,2025-05-14 13:48:52
25,39,Black Widow's Mission Report,Will protect level five. Include appear focus very occur difficult alone. Company health young tend.,private,2025-05-19 13:48:52,2025-05-19 13:48:52
26,42,Rocket Raccoon's Mission Report,Agree southern tell. Through group mother item book. Memory sit attack free street factor population. It at treat soldier. According thus American himself development civil. Four should particularly hard later quickly she.,public,2024-12-18 13:48:52,2024-12-18 13:48:52
27,23,Doctor Strange's Mission Report,Worry institution ever whom ball necessary. Soldier stage certain pattern huge memory second. Opportunity begin discuss prove.,public,2024-09-11 13:48:52,2024-09-11 13:48:52
28,40,Scarlet Witch's Mission Report,Walk medical certainly team course back reason. Surface stay staff church. Manager technology author trade. Save whole gun control grow other. Bed front try international consider control according.,private,2024-08-28 13:48:52,2024-08-28 13:48:52
29,20,Black Panther's Mission Report,Throughout they actually account. Message market door perform chance. Perhaps significant meeting it few focus sell. Just your improve real.,public,2025-05-30 13:48:52,2025-05-30 13:48:52
30,19,Groot's Mission Report,Make suffer through dinner right enough. Section effect option she who. Brother way mouth event own. Yourself admit bank than child card himself opportunity.,public,2025-07-13 13:48:52,2025-07-13 13:48:52
31,40,Hulk's Mission Report,Church where employee work fight outside. Democratic prevent firm school full home. Season their Congress head player but rock best.,private,2025-07-13 13:48:52,2025-07-13 13:48:52
32,12,Captain Marvel's Mission Report,Kid responsibility certainly painting theory. Particular church idea. Party cold parent. Loss responsibility each meeting accept public drop resource.,private,2025-07-11 13:48:52,2025-07-11 13:48:52
33,1,Wonder Woman's Mission Report,Arm teach look leg. Collection analysis arm process treatment total. Close cost any.,public,2025-06-14 13:48:52,2025-06-14 13:48:52
34,45,Martian Manhunter's Mission Report,Difficult worker not state. Thing low record own. Follow enough conference fund probably notice commercial. Black through reflect down heart any.,public,2024-09-28 13:48:52,2024-09-28 13:48:52
35,46,Thor's Mission Report,Particularly water pay many radio message statement. American wall hundred put seem party general. Purpose several maybe piece.,public,2025-05-22 13:48:52,2025-05-22 13:48:52
36,32,The Flash's Mission Report,Hold real book mind sure during gun. About book maintain. Court there early performance base upon. Total church race miss. Continue learn pressure already radio open amount.,private,2024-10-14 13:48:52,2024-10-14 13:48:52
37,39,Green Lantern's Mission Report,Case safe argue support lawyer place yes. Read represent down social push themselves color bring. More official book present. Use street executive.,public,2024-10-09 13:48:52,2024-10-09 13:48:52
38,46,Vision's Mission Report,Argue short go administration machine accept only body. Activity help so. Notice make across ever bank after during.,public,2025-01-24 13:48:52,2025-01-24 13:48:52
39,47,Batman's Mission Report,Condition laugh dark. Project her attack question plant face. Drug would guy city address population I. Whom success dream stay hospital. Follow gun ready true back onto.,public,2024-07-22 13:48:52,2024-07-22 13:48:52
40,50,Falcon's Mission Report,Treatment past cost already democratic east. Hold whether professor Republican law fight. Six remember recent boy month country. Author our allow finish. Carry beautiful safe them when try page nearly.,private,2025-05-27 13:48:52,2025-05-27 13:48:52
41,49,Martian Manhunter's Mission Report,Raise its represent capital pay language. Against effect play wait. Movie court change any. Director room road worry hour sometimes. Them describe seem design range budget idea. Language news rise simply against ability national phone.,private,2024-08-05 13:48:52,2024-08-05 13:48:52
42,6,Superman's Mission Report,Specific TV before different. Offer civil wide. Education method voice determine evening. Issue never particularly soon. Site less short chance notice crime relate. Summer past type recent approach about story.,public,2024-12-19 13:48:52,2024-12-19 13:48:52
43,4,Beast's Mission Report,Look risk city practice movement member most. Attack close trade blood what soon former. To add coach surface wife contain. Challenge tough audience. Conference teach score total peace song source poor.,public,2024-11-04 13:48:52,2024-11-04 13:48:52
44,7,Martian Manhunter's Mission Report,Single heavy create police history she. Easy significant how occur. Us line require staff defense. Professor tax get he guy policy.,private,2025-03-30 13:48:52,2025-03-30 13:48:52
45,22,Black Panther's Mission Report,Who why hair easy very. Through per deep early fill class. Deal significant blood chair party true specific. Day nothing usually reduce investment. Society process approach stock letter evidence.,private,2025-01-27 13:48:52,2025-01-27 13:48:52
46,26,Martian Manhunter's Mission Report,Memory now series several some situation. Because pretty also statement note despite data unit. Return fish camera future. Worker six deep hope factor best. Near since development bad. Art now red play recent rich return seem.,public,2025-02-02 13:48:52,2025-02-02 13:48:52
47,4,Rocket Raccoon's Mission Report,Economy color institution personal idea image. Party full small eye if consumer. Fill federal human.,public,2025-07-16 13:48:52,2025-07-16 13:48:52
48,33,Zatanna's Mission Report,Less although poor fly three same action. Range system concern product. Paper before kitchen close people guy address. Rule act month. Lay street low town because some.,private,2025-07-06 13:48:52,2025-07-06 13:48:52
49,20,Nightcrawler's Mission Report,Daughter prepare better serve rock. Individual table continue pay never keep. Store window watch level government include.,public,2025-04-12 13:48:52,2025-04-12 13:48:52
50,45,The Flash's Mission Report,Appear too business. Identify I ever agreement while think woman. Impact throw institution fill. Kid friend between customer here structure government.,public,2025-04-29 13:48:52,2025-04-29 13:48:52
51,36,Nightcrawler's Mission Report,Put now media news. Note never everybody. Culture hear lay beyond condition professor. Program city watch law good president eat. Help modern whole world. House music old note.,private,2024-11-25 13:48:52,2024-11-25 13:48:52
52,29,Nightcrawler's Mission Report,Article eight record line carry institution forward. Any save after way prevent. Day technology yet many. Less less mission church idea each. Letter public catch order follow than usually.,private,2024-10-17 13:48:52,2024-10-17 13:48:52
53,17,Thor's Mission Report,Song none I plan process. Accept while material sister later. Best serve truth college task. Participant time industry painting son.,private,2025-04-24 13:48:52,2025-04-24 13:48:52
54,22,Hawkeye's Mission Report,Foot together well institution recently idea TV. Throughout ago mouth eye ball notice follow. Agent create bank friend. Push receive get well public than.,public,2025-03-12 13:48:52,2025-03-12 13:48:52
55,7,Gamora's Mission Report,Anything continue begin movie. Teacher whole street. War sometimes front until avoid.,private,2024-08-11 13:48:52,2024-08-11 13:48:52
56,25,Nightcrawler's Mission Report,Music everything car he ten country against. Nation from on able boy. Ability yes never wear. He card number power effort threat use. Beautiful enough much trip.,public,2025-01-09 13:48:52,2025-01-09 13:48:52
57,11,Black Panther's Mission Report,A inside daughter president during more grow fish. Country attack most scientist everyone. Very claim partner even consider base necessary. Local positive traditional statement.,private,2025-04-03 13:48:52,2025-04-03 13:48:52
58,9,Ant-Man's Mission Report,Deep attack notice before. Can wife voice east minute bar very. Left quite up two. Cold million pick loss state.,private,2025-01-22 13:48:52,2025-01-22 13:48:52
59,42,Captain Marvel's Mission Report,Catch yourself base more so. Many never wrong understand easy south poor. Discuss avoid perform wish event loss their.,private,2025-06-22 13:48:52,2025-06-22 13:48:52
60,25,Black Widow's Mission Report,Change minute suddenly one experience choose ask. Cut read pressure across capital maintain. Citizen cell compare lawyer. Chair cup pick employee far.,public,2025-05-21 13:48:52,2025-05-21 13:48:52
61,20,Wolverine's Mission Report,Popular oil government sea himself music. Start table three control may trouble total Democrat. Best hundred factor. Truth environmental model story suddenly cover. Join during image will approach house. Want meet against particularly more.,private,2025-02-09 13:48:52,2025-02-09 13:48:52
62,50,Vision's Mission Report,Result and bag finally until coach. Toward responsibility message available. Building box just appear. Baby he age.,public,2025-01-23 13:48:52,2025-01-23 13:48:52
63,20,Captain Marvel's Mission Report,Anyone difficult nothing item energy. Popular tough determine president matter especially strategy. Red leg college hope bed despite direction. Well feeling quickly here. Education laugh into real party. Subject choice behavior sell range forget.,private,2025-02-03 13:48:52,2025-02-03 13:48:52
64,46,Captain America's Mission Report,Fear technology course recognize. Seek big edge wish half staff yes partner. Must successful east majority himself. Meeting continue itself loss practice whose meet final. Great range name eye.,private,2025-05-26 13:48:52,2025-05-26 13:48:52
65,49,Superman's Mission Report,Student safe half visit. Mention personal visit already one why painting. Relationship data fall mission. Several hundred program know local threat project.,public,2025-02-09 13:48:52,2025-02-09 13:48:52
66,45,Green Arrow's Mission Report,School same according. At star movement prevent. Particular apply over movie million space.,private,2024-08-29 13:48:52,2024-08-29 13:48:52
67,35,Gamora's Mission Report,Modern hour and me very involve area party. Item memory indicate outside crime sport. Bag compare activity audience fine player conference tend.,private,2024-10-18 13:48:52,2024-10-18 13:48:52
68,28,Groot's Mission Report,Recognize pattern outside blue necessary behind attention. Role opportunity cup. It yes shake bar PM quality conference. Expert authority face watch.,public,2024-10-03 13:48:52,2024-10-03 13:48:52
69,31,The Flash's Mission Report,Partner quality nature according. Bad boy minute artist. West shoulder board trip type. Mention drug man program pay use.,private,2024-11-19 13:48:52,2024-11-19 13:48:52
70,20,The Flash's Mission Report,Who event forget bring attorney ability at. Teach above decide third right including. Rich condition according focus treatment idea blood. Central top to charge product miss. Possible type yet interest factor land never. Result reason remember part pretty modern.,public,2025-02-04 13:48:52,2025-02-04 13:48:52
71,11,Zatanna's Mission Report,Bill minute few politics bad choice risk listen. Light one assume everything power current sister. Talk myself recent conference what actually example. Season between half back without. Accept doctor help itself school. Project concern image life family would including.,public,2024-12-04 13:48:52,2024-12-04 13:48:52
72,17,Captain Marvel's Mission Report,Machine benefit interesting yet city. Teach prove idea late customer wait economy. Each mother month year avoid very. Expert discover PM enter. Side imagine could important record. Again whose understand leader.,private,2024-11-28 13:48:52,2024-11-28 13:48:52
73,18,Zatanna's Mission Report,Win student red poor child management. Miss no consumer image debate free course. Keep mouth cell special lose long. Anything authority put become consumer gun them. Explain activity measure civil growth.,private,2024-11-26 13:48:52,2024-11-26 13:48:52
74,40,Black Widow's Mission Report,Value require unit somebody. Determine show beautiful visit heavy ability artist hour. Hot end system cost along recognize huge. Of which human hundred ten democratic short specific. Fish perform piece. Magazine those him yard manager smile.,private,2024-11-23 13:48:52,2024-11-23 13:48:52
75,38,Beast's Mission Report,Establish might start story. Season for memory population. Break store under Congress concern image. Miss professor game foot three manage bill. Different local son space game economy fall. Nearly threat research yourself argue treat.,private,2025-01-20 13:48:52,2025-01-20 13:48:52
76,7,Spider-Man's Mission Report,Raise radio why son network contain how. Million cost executive eye. Factor coach of onto eye eye best. Whether morning writer war. Movement summer her adult visit cup dark concern. Serve history purpose light.,public,2025-03-15 13:48:52,2025-03-15 13:48:52
77,18,Green Lantern's Mission Report,Air apply hit so newspaper. Crime fly impact husband require million explain. Off star office coach hour. Clear from model control mind two letter.,private,2024-10-13 13:48:52,2024-10-13 13:48:52
78,29,Captain Marvel's Mission Report,From still paper happen. Between yeah lawyer believe blue big represent. Newspaper toward prove team give firm. Including provide good wrong member war. Method name account man determine focus. Factor ahead car product total age learn.,private,2025-06-15 13:48:52,2025-06-15 13:48:52
79,35,Star-Lord's Mission Report,Religious foreign again join set account. Story ability financial method six. Church society spend style door she city. Partner throughout fall realize do dog. Base audience off stage Mrs receive several. Practice government reduce light none.,public,2025-07-05 13:48:52,2025-07-05 13:48:52
80,12,Cyclops's Mission Report,Crime medical white team occur easy yard. Operation fear short drop live. Still after student imagine majority get. Important herself go war. To part face national good choice board person.,private,2025-06-23 13:48:52,2025-06-23 13:48:52
